,Дата і час публікації,Текст повідомлення,Наратив,"Канал, який поширив повідомлення"
32,2022-04-08 10:54:28,Над ЖД вокзалом Краматорска сбили Точку-У. Напоминаю что на вооружении армий РФ/ДНР/ЛНР нет Точек-У.,Точка У - только украинское оружие,https://t.me/breege_time_20zz
69,2022-04-08 11:18:35,"Жуть, конечно. Люди собирались эвакуироваться, а их свои же и накрыли Напомним, что именно Верещук призывала жителей Донецкой и Луганской областей, над которыми Киев еще сохранял контроль (+Харьковская область) в спешном порядке эвакуироваться. Вероятно, для того, чтобы ВСУ силами подтянутых резервов сравняли населенные пункты с землей. А вышло так, что начали равнять вместе с жителями Кровь погибших сегодня в Краматорске так же на руках Верещук",Использование живого щита,https://t.me/go338
74,2022-04-08 11:24:24,"В ДНР сообщают, что ВСУ нанесли удар ""Точкой-У"" по Краматорску. Обломки упали рядом с вокзалом. ",Свидетельства представителей ДНР и РФ,https://t.me/sputniklive
104,2022-04-08 11:32:14,"Официальные власти заявляют об ударе двумя ""Искандерами"" по вокзалу. Там бы живого места не осталось и получилась бы огромная воронка, если бы применяли осколочно-фугасный снаряд. Характерных следов от применения кассетного боеприпаса нет — стекла целые. Вызывают вопросы и сгоревшие автомобили. Борис Рожин пишет, что это упала сбитая ""Точка-У"". #Донецк #Украина *Поддержать нас: 4377 7278 0407 7977",Траектория полета,https://t.me/rybar
249,2022-04-08 11:45:40,"Краматорск. Ради оружия и новых санкций против России Украина опять убила своих собственных граждан. На этот раз нелюди ударили ""точкой-у"" по ж/д вокзалу, где шла эвакуация гражданского населения. Разумеется, упыри тут же обвинили во всем Россию, моментально начав снимать на видео последствия своего же преступления.","Украине выгодно, России - нет",https://t.me/newsfrontnotes
263,2022-04-08 11:48:28,"В Краматорске десятки человек погибли в результате падения украинской ракеты ""Точка-У"" в районе ж/д вокзала. Уже несколько дней местные жители массово покидают город, а вокзале постоянно людно. Отсюда и такое количество жертв от прилета ракеты со стороны позиций ВСУ. На данный момент сообщается о 30 погибших и порядка сотни раненных. Данные уточняются. Фото штаба территориальной обороны ДНР. ",Территория запуска контролируется ВСУ,https://t.me/donbassr
296,2022-04-08 11:52:24,"А вот и Арестович высказался по удару по ж/д вокзалу Краматорска. Что и требовалось доказать – Киев создаёт вторую Бучу. Точно такую же фейковую. Вот уж правда, с какими же блядями нам приходится воевать… Только это применимо именно к Киеву.",Свидетельства украинских источников,https://t.me/rlz_the_kraken
296,2022-04-08 11:52:24,"А вот и Арестович высказался по удару по ж/д вокзалу Краматорска. Что и требовалось доказать – Киев создаёт вторую Бучу. Точно такую же фейковую. Вот уж правда, с какими же блядями нам приходится воевать… Только это применимо именно к Киеву.",Украина постоянно использует провокации такие как єта,https://t.me/rlz_the_kraken
330,2022-04-08 11:55:32,"На обломках ракеты, которая ударила по Краматорску, судя по всему надпись ""За детей"". Это очередное, хоть и косвенное подтверждение, что ракета была выпущена украинской армией Inside Donetsk",Надпись за детей,https://t.me/doninside
377,2022-04-08 11:57:51,"По Крамоторску. Сверху ракета упавшая в Крамоторске, снизу для примера ракета комплекса ""Искандер"". Однозначно по Крамоторску ударили ""Точкой-У"" и то, что Украина так истерично это отрицает и указывает на ""Искандер"" красноречиво говорит об виновнике. ""На воре и шапка горит!""",Украина путалась и лгала,https://t.me/talipovonline
436,2022-04-08 12:01:09,"Сообщается, что прилёт ""Точки-У"" по Краматорску был со стороны подконтрольных Украине территорий, вероятно, с юго-запада. Сам город сейчас тоже под контролем ВСУ и, вероятно, был выбран мишенью вследствие отсутствия в этом регионе российского ПВО. На сбитой ракета надпись — ""За детей"". Очевидно, что написать на ракете можно что угодно, тем более никаких сомнений в том, что украинцы умеют писать, знают русских язык и у них есть белая краска. Считаем удар и эту надпись срежиссированной провокацией со стороны Украины.",Россия не могла сбить своим ПВО,https://t.me/ssigny
495,2022-04-08 12:08:54,"Зеленский уже начал театр. Откуда-то у президента Украины кадры, которые ранее не появлялись нигде. Вероятно, на месте уже ждали репортёры, которые сделали снимки. И, конечно же, появилось видео, на котором мужчина рассказывает про убитых и покалеченных и надпись ""За детей"". Надпись на на русском языке на украинской ракете, выпущенной со стороны Украины никак не может доказывать причастность к удару по вокзалу Краматорска со стороны ВС РФ или ДНР. Также напомним, что Украина примеряла похожую тактику на протяжении 8 лет на Донбассе и Луганщине. Например, летом 2014 года был нанесён ракетный удар по автовокзалу в Луганске. Погибли десятки человек, в том числе и дети.",Сходство с обстрелом Донецка,https://t.me/ssigny
601,2022-04-08 12:16:57,"Обломок упавшей ракеты крупным планом. Вероятно, это фото не должно было появиться в Сети, поскольку на корню рубит фейк про удар ""русскими Искандерами"". И поэтому теперь украинская сторона спешно переобувается. Так, Зеленский уже заявил, что удар был нанесён не Искандерами, а ""российской Точкой-У"", при том, что данный комплекс является устаревшим и не применяется Русской Армией. ",Россия использует только высокоточное оружие,https://t.me/ags_donbass
686,2022-04-08 12:29:53,"Видео запуска украинских ""Точек-У"", ударивших по вокзалу в Краматорске UPD: На видео, предположительно, не пуск украинских ""Точек"", а работа российского ПВО, сбившего одну из ракет. Ракеты ПВО были выпущены из подконтрольного ДНР Шахтёрска.",Ракета сбита ПВО,https://t.me/ssigny
750,2022-04-08 12:35:42,"Кровавое шапито Зе&Со на фоне Бучи практически открытым текстом признавали, что уже готовят новые провокации. Они не заставили себя ждать. У подонков, для которых собственное население лишь пушечное мясо что в боевых действиях, что в инфовойне, руки развязаны полностью. Ничто не ограничивает. Тем более, что руки киевского решима в крови по локоть уже восемь лет. И в целом для укронаци разницы особой между Донецком и Краматорском нет. Кстати, о Донецке. Помните, перед ударом ‘Точкой-У’ сначала была смс-рассылка? С призывам придти в определенное место... именно то, куда прилетела потом ‘Точка-У’. Так вот, в Краматорске накануне также массово оповещали людей об эвакуации с ж/д вокзала, куда и прилетело потом. Почерк очевидный... Тёма в теме.",Обвинение украинских властей в возможном повторении,https://t.me/gardez66
978,2022-04-08 13:01:46,"Именно в районе Краматорска стоят десять установок Точек-У ВСУ. Эту информацию лично мне передавали мирные жители с этого города. Вполне вероятно, что ракета была выпущена с окраин Крамоторска. Ракета могла быть сбита ПВО над городом или же, как и всё в ВСУ, установка, как и боеприпас были не обслужены и ракета взорвалась, не долетев до цели( в нашу сторону) ВСУ каждый день по несколько штук с того направления запускает эти ракеты. Благо, наше ПВО их сбивают. На видео небольшая часть ракет данного комплекса, которые были сбиты в небе над ДНР.",Ошибка,https://t.me/rtrdonetsk
1065,2022-04-08 13:14:27,"Ракеты ПВО, выпущенные с территории ДНР сегодня утром, работали по целям в воздухе, но украинская пропаганда использует это для дезинформации по трагедии в Краматорске Показательный момент: в проукраинских ресурсах сегодня распространилась информация о запуске ПВО по целям в воздухе с территории, контролируемой ДНР (город Шахтерск). На видео видно парный пуск ракет, траектория и активное маневрирование их после старта подтверждают работу ЗРК по воздушной цели, а не ракет класса ""земля-земля"". Однако киевские пропагандисты стали использовать это видео как доказательство того, что ""Точки У"" были выпущены с нашей территории, а не соединениями ВСУ. Тот факт, что это не правдоподобно, видимо, местных умельцев совсем не интересует. Главное — нагнетать и обвинить Россию. Отметим, что в обстреле собственного мирного населения есть циничная тактика ВСУ. Замедлить или вовсе остановить выход гражданского населения из городов — их единственный шанс остановить продвижение ВС РФ в предстоящей битве за Донбасс.",Фейк: территория запуска контролируется ДНР (Россией),https://t.me/readovkanews
1065,2022-04-08 13:14:27,"Ракеты ПВО, выпущенные с территории ДНР сегодня утром, работали по целям в воздухе, но украинская пропаганда использует это для дезинформации по трагедии в Краматорске Показательный момент: в проукраинских ресурсах сегодня распространилась информация о запуске ПВО по целям в воздухе с территории, контролируемой ДНР (город Шахтерск). На видео видно парный пуск ракет, траектория и активное маневрирование их после старта подтверждают работу ЗРК по воздушной цели, а не ракет класса ""земля-земля"". Однако киевские пропагандисты стали использовать это видео как доказательство того, что ""Точки У"" были выпущены с нашей территории, а не соединениями ВСУ. Тот факт, что это не правдоподобно, видимо, местных умельцев совсем не интересует. Главное — нагнетать и обвинить Россию. Отметим, что в обстреле собственного мирного населения есть циничная тактика ВСУ. Замедлить или вовсе остановить выход гражданского населения из городов — их единственный шанс остановить продвижение ВС РФ в предстоящей битве за Донбасс.",Фейк: видео пуска,https://t.me/readovkanews
1068,2022-04-08 13:15:18,"Девочки, довольно мутная история с ракетой, которая сегодня упала в Краматорске, как сообщают, на мирных жителей. Это ""Точка-У"", которой нет на вооружении у ВС РФ. Ее хорошо видно на фото. Тут интересно, что падение этой ракеты сопровождалось дезой в российских телеграм-каналах. Как нам кажется, их могли намеренно развести для информационного сопровождения этого вброса. Работает ЦИПсО. Все хотят устроить вторую Бучу, да не могут. Этого не будет ни у Красильщика, ни в твиттере. Никто не поставит на свои аватарки чёрный флаг. Жителей Краматорска собирали на вокзале несколько дней перед ударом. ""Милитарист"" обращает внимание на тайминг удара.",Украина пыталась сокрыть важные детали,https://t.me/cyber_frontz
1141,2022-04-08 13:24:00,"Украинская сторона выдает видео пуска зенитных ракет в Шахтерске, расположенном к востоку от Донецка и, соответственно, к юго-востоку от Краматорска, за ""Точки-У"". Мы уже писали, что прилёт был с юго-запада. Об этом свидетельствует положение обломков на земле. Вернемся к видео: Маршевый двигатель ""Точки-У"" работает 22-23 секунды. На указанного видео работа маршевого двигателя гораздо меньше. Время подлета на максимальную дальность составляет 136 секунд. Воздушная тревога была объявлена в 10.30 Мск. Согласно метаданным, ролик из Шахтерска был записан в 9.22. Даже если предположить, что на конкретном устройстве выставлено время по GMT+2, время подлета ""Точки-У"" до цели на максимальном расстоянии — это 2 минуты 16 секунд. Ещё остается 5 с лишним минут только до объявления тревоги. Данное видео подтверждает факт работы ПВО ДНР по вражеским ""Точкам-У"" этим утром. #Донецк #Краматорск #Украина *Поддержать нас: 4377 7278 0407 7977","Время взрыва (подлета, пуска)",https://t.me/rybar
1204,2022-04-08 13:33:42,"#Краматорск Цензура в городе сверхжесткая, и показательных арестов хватает. Тем не менее, после сегодняшнего ужасного утра местные жители обсуждают ракету и её ""маршрут"". В сумме с ложью Киева об ""Искандере"" (который оказался ""Точкой-У"") картина вырисовывается очень неприятная. После Бучи на Банковой решили не снижать накал ненависти и шума. Заодно можно выбить больше вооружений и денег",Свидетельства украинских Telegram-каналов,https://t.me/denazi_ua
1297,2022-04-08 13:45:52,"По данным разведки Донецкой Народной Республики, украинские вооруженные формирования в ближайшее время планируют совершить массированные обстрелы из ""Градов"" и другого тяжелого вооружения жилых кварталов Краматорска, Славянска, Артемовска, возможно, Мариуполя и других населенных пунктов Донбасса, на данный момент еще подконтрольных Украине. Целью этого преступления является обвинение в обстрелах, разрушениях жилья и инфраструктуры, возможной гибели людей подразделений Республик и России. Убедительная просьба к жителям этих населенных пунктов укрыться в убежищах, предпринять все возможные меры безопасности, чтобы сохранить свою жизнь и здоровье. Мы считаем все население в границах бывшей Донецкой области нашими согражданами: вы голосовали в 2014 году за независимость Донецкой Народной Республики, и нам ценна каждая жизнь! Жестокость и циничность преступных приказов украинского режима мы испытали на себе. Поэтому повторяю: срочно примите максимально возможные меры безопасности!","Существуют подтверджение, что обстрел готовился",https://t.me/ags_donbass
1415,2022-04-08 14:06:45,"Эдуард Басурин в эфире #60минут сообщил, что ВСУ обстреляли Краматорск ‘Точкой-У’ с кассетными боеприпасами! Такой же ракетой был обстрелян центр Донецка 14 марта ‘Очередная провокация для картинки. Сработали кассеты, поэтому количество пострадавших и площадь поражения была очень большой. Тут же с украинской стороны было заявление, что это сделано РФ ‘Искандерами’. Но они не учли одного: что у людей есть огромное количество телефонов, на которые можно снять последствия. Они засняли остатки ‘Точки-У’ ‘Точка-У’ есть на вооружении только украинской армии. Больше не у кого! Я думаю, доказательная база будет предоставлена: откуда была пущена и разведданные скажут, кто именно написал кнопку ‘пуск’ ",Расположение и действия 19 бригады,https://t.me/kedmi
