1729,2022-04-08 15:31:57,"Пока нет официальных данных по боевой части ракеты. А, учитывая, что ситуация на укронацистской стороне, правду мы узнаем только если проведем свой ""Нюрнберг"". Но по часто встречающимся предположениям с 2-х сторон - это был именно кассетный боеприпас. Я вот не помню, где за 1,5 месяца Россия использовала для уничтожения военных и военно-инфраструктурных объектов именно кассетную БЧ. Везде шла ставка на фугасность и бризантность. Именно по причине того, что цель - разрушение объекта, а не живая сила противника, если речь про близость городской застройки. Но. Я вот отлично помню и даже наблюдал лично недавний прилет кассетного боеприпаса ""Точки-У"" прямо по центру Донецка. Для максимизации жертв среди беззащитных гражданских. Где даже специально УкроИПсО провело провокацию, чтобы на площади под бывшей ОГА собралось как можно больше женщин, которую мы подробно разбирали. А дальше фото попадания Точкой-У по Донецку лживые укронацистские твари и западные СМИ выдавали за обстрелы Киева. А потом и Макеевка. И Мелитополь. А потом сбитая ""Точка-У"" в полях Луганщины с касетной БЧ. А вот укропы с гордостью показывают запуски. И еще много-много раз. Как нас учит принцип ""бритвы Оккама"" - не умножай сущностей сверх необходимого. Самая первая версия, учитывая вышесказанное - укронацисты.",Демонстрация запусков ракет Украиной,https://t.me/za_derjavy
1851,2022-04-08 16:39:47,"‼ Цель удара украинских властей по вокзалу в Краматорске: Срыв массового выезда жителей из города, чтобы использовать их в качестве живого щита для обороны позиций ВСУ. Телефоны, фотоаппараты, которые были у очевидцев, зафиксировали, что это остатки ""Точки-У"". Такое вооружение не ЛДНР, не Россия - не используют. Некоторые антироссийские интернет-газеты пытаются обвинить в ударе Россию. Они ссылаются на заявление BBC, что Точка-у могла отставатся на вооружении у России, и что какая-то команда якобы подтвердила что Точки У находятся на вооружении России. Сила V Правде - ",'Точка-У' не используется ЛДНР и Россией,https://t.me/borodavchenkoznaet
1901,2022-04-08 17:04:39,"‘Если его друзья- это Белоруссия, Северная Корея и Венесуэла, то это не та вечеринка, где я бы хотел присутствовать’ Бен Уолесс, министр обороны Британии, уже определил всех виновных в обстреле Краматорска. И, конечно же, по его мнению , это Путин. После этого, с его слов, Британия сделает всё, чтобы Путин потерпел на Украине неудачу. Уолесс считает, что союзников у России практически не осталось ‘Принципиально президент Путин прислушивается только к силе. В конце концов, он прислушается, когда месседж и правда дойдут до его народа, и он прислушается к последствиям того, что он сделална Украине. Он выслушает прислушается к санкциям. Где сейчас российская экономика? Где сейчас рубль? Где его друзья? Если его друзья это Белоруссия, Северная Корея и Венесуэла, то это не вечеринка, где я хотел бы присутствовать. Это не такая уж и стоящая дружественная группа. И я думаю, что его больше не стоит провоцировать. Его можно сдержать , и мы можем помочь Украине победить его и отбросить его армию’ ",Свидетельства Западных официальных лиц,https://t.me/kedmi
3233,2022-04-10 12:41:59,"Это уже не сомнительный по эффективности ""Старстрик"". Это современный универсальный ракетный комплекс ""Мартлет"", поставленный англичанами в ВСУ. Похоже, англичане решили вложиться в украинскую войну ""по полной"", и останавливаться не собираются.","Использование ""Мартлет"" ВСУ",https://t.me/solovievlive
3779,2022-04-13 11:38:00,"Батюшки, зрада-то какая! Би-Би-Си открытым текстом заявляет, что массовое убийство на вокзале в Краматорске совершила Украина. Либо Би-Би-Си взломали, либо украинское враньё достало даже их.",Доказательства от BBC,https://t.me/dtlive
4184,2022-04-15 21:33:07,Для имитации удара якобы со стороны подконтрольной Вооруженным Силам России и формированиям Донецкой Народной Республики территории пуск ракет будет осуществлен со стороны населенного пункта Старомихайловка - Мизинцев,Имитация удара с территории России,https://t.me/zvezdanews
